{
  "source": {
    "repo": "https://github.com/androidx/androidx",
    "commit": "1358a48e9c23e257ae3357f6f645cb60a3610a7f",
    "file": "compose/material3/material3/src/commonMain/kotlin/androidx/compose/material3/MaterialShapes.kt",
    "graphicsShapes": "androidx.graphics:graphics-shapes:1.0.1"
  },
  "space": "unit square [0,1]x[0,1], y down (Compose/SVG), post RoundedPolygon.normalized()",
  "cubic": "[anchor0x, anchor0y, control0x, control0y, control1x, control1y, anchor1x, anchor1y]",
  "shapes": {
    "circle": {
      "center": [0.50405,0.5],
      "bounds": [0,0.00405,1,0.99595],
      "cubics": [
        [1,0.5,1,0.55173,0.99191,0.60345,0.97573,0.65326],
        [0.97573,0.65326,0.94336,0.75287,0.88029,0.83967,0.79556,0.90124],
        [0.79556,0.90124,0.71083,0.9628,0.60878,0.99595,0.50405,0.99595],
        [0.50405,0.99595,0.39931,0.99595,0.29726,0.9628,0.21253,0.90124],
        [0.21253,0.90124,0.1278,0.83967,0.06473,0.75287,0.03236,0.65326],
        [0.03236,0.65326,0,0.55365,0,0.44635,0.03237,0.34674],
        [0.03237,0.34674,0.06473,0.24713,0.1278,0.16033,0.21253,0.09876],
        [0.21253,0.09876,0.29726,0.0372,0.39931,0.00405,0.50405,0.00405],
        [0.50405,0.00405,0.60878,0.00405,0.71083,0.0372,0.79556,0.09876],
        [0.79556,0.09876,0.88029,0.16033,0.94336,0.24713,0.97573,0.34674],
        [0.97573,0.34674,0.99191,0.39655,1,0.44827,1,0.5]
      ]
    },
    "square": {
      "center": [0.5,0.5],
      "bounds": [0,0,1,1],
      "cubics": [
        [0.91213,0.91213,0.85784,0.96642,0.78284,1,0.7,1],
        [0.7,1,0.56667,1,0.43333,1,0.3,1],
        [0.3,1,0.13431,1,0,0.86569,0,0.7],
        [0,0.7,0,0.56667,0,0.43333,0,0.3],
        [0,0.3,0,0.13431,0.13431,0,0.3,0],
        [0.3,0,0.43333,0,0.56667,0,0.7,0],
        [0.7,0,0.86569,0,1,0.13431,1,0.3],
        [1,0.3,1,0.43333,1,0.56667,1,0.7],
        [1,0.7,1,0.78284,0.96642,0.85784,0.91213,0.91213]
      ]
    },
    "slanted": {
      "center": [0.5,0.5],
      "bounds": [0,0.03802,1,0.96198],
      "cubics": [
        [0.87553,0.91402,0.86773,0.92106,0.85933,0.92742,0.85041,0.93306],
        [0.85041,0.93306,0.80464,0.96198,0.74103,0.96178,0.6138,0.96138],
        [0.6138,0.96138,0.47652,0.96094,0.33923,0.96051,0.20195,0.96007],
        [0.20195,0.96007,0.19245,0.96004,0.1877,0.96003,0.185,0.95994],
        [0.185,0.95994,0.08063,0.95655,0,0.86705,0.00749,0.76289],
        [0.00749,0.76289,0.00768,0.76021,0.00816,0.75548,0.00912,0.74602],
        [0.00912,0.74602,0.0228,0.61113,0.03647,0.47625,0.05015,0.34136],
        [0.05015,0.34136,0.06298,0.21478,0.0694,0.15149,0.10293,0.10898],
        [0.10293,0.10898,0.11598,0.09242,0.13176,0.07821,0.14959,0.06694],
        [0.14959,0.06694,0.19536,0.03802,0.25897,0.03822,0.3862,0.03862],
        [0.3862,0.03862,0.52348,0.03906,0.66077,0.03949,0.79805,0.03993],
        [0.79805,0.03993,0.80755,0.03996,0.81231,0.03997,0.815,0.04006],
        [0.815,0.04006,0.91937,0.04345,1,0.13295,0.99251,0.23711],
        [0.99251,0.23711,0.99232,0.2398,0.99184,0.24452,0.99088,0.25398],
        [0.99088,0.25398,0.9772,0.38887,0.96353,0.52375,0.94985,0.65864],
        [0.94985,0.65864,0.93702,0.78522,0.9306,0.84851,0.89707,0.89102],
        [0.89707,0.89102,0.89054,0.8993,0.88334,0.90699,0.87553,0.91402]
      ]
    },
    "arch": {
      "center": [0.5,0.5],
      "bounds": [0,0,1,1],
      "cubics": [
        [0.14645,0.14645,0.23693,0.05596,0.36193,0,0.5,0],
        [0.5,0,0.77614,0,1,0.22386,1,0.5],
        [1,0.5,1,0.61953,1,0.73905,1,0.85858],
        [1,0.85858,1,0.93668,0.93668,1,0.85858,1],
        [0.85858,1,0.61953,1,0.38047,1,0.14142,1],
        [0.14142,1,0.06332,1,0,0.93668,0,0.85858],
        [0,0.85858,0,0.73905,0,0.61953,0,0.5],
        [0,0.5,0,0.36193,0.05596,0.23693,0.14645,0.14645]
      ]
    },
    "fan": {
      "center": [0.49976,0.50069],
      "bounds": [0.00045,0,0.99955,1],
      "cubics": [
        [0.95718,0.95532,0.93885,0.97414,0.9155,0.98808,0.88918,0.99506],
        [0.88918,0.99506,0.87056,1,0.84304,1,0.78801,1],
        [0.78801,1,0.57575,1,0.3635,1,0.15124,1],
        [0.15124,1,0.06797,1,0.00045,0.93249,0.00045,0.84921],
        [0.00045,0.84921,0.00045,0.61604,0.00045,0.38287,0.00045,0.1497],
        [0.00045,0.1497,0.00045,0.06672,0.06876,0,0.15172,0.00195],
        [0.15172,0.00195,0.17267,0.00244,0.19362,0.00294,0.21458,0.00343],
        [0.21458,0.00343,0.64174,0.01347,0.98599,0.3567,0.99732,0.78382],
        [0.99732,0.78382,0.99733,0.78422,0.99735,0.78462,0.99736,0.78502],
        [0.99736,0.78502,0.99882,0.84004,0.99955,0.86754,0.9951,0.88629],
        [0.9951,0.88629,0.98882,0.91279,0.9755,0.93649,0.95718,0.95532]
      ]
    },
    "arrow": {
      "center": [0.49942,0.48384],
      "bounds": [0,0.08336,1,0.91664],
      "cubics": [
        [0.49939,0.83686,0.47894,0.83676,0.45848,0.83892,0.43839,0.84335],
        [0.43839,0.84335,0.38492,0.85515,0.33145,0.86695,0.27798,0.87875],
        [0.27798,0.87875,0.12196,0.91318,0,0.7449,0.08128,0.60735],
        [0.08128,0.60735,0.11182,0.55567,0.14236,0.50399,0.17289,0.45232],
        [0.17289,0.45232,0.31811,0.20657,0.39072,0.08369,0.49882,0.08353],
        [0.49882,0.08353,0.60693,0.08336,0.67992,0.20601,0.82589,0.45131],
        [0.82589,0.45131,0.85596,0.50184,0.88603,0.55237,0.9161,0.6029],
        [0.9161,0.6029,1,0.74389,0.87382,0.91664,0.71398,0.8796],
        [0.71398,0.8796,0.66276,0.86773,0.61153,0.85586,0.56031,0.84399],
        [0.56031,0.84399,0.54027,0.83935,0.51983,0.83697,0.49939,0.83686]
      ]
    },
    "semi-circle": {
      "center": [0.5,0.5],
      "bounds": [0,0.1875,1,0.8125],
      "cubics": [
        [0.96949,0.78199,0.95064,0.80084,0.9246,0.8125,0.89583,0.8125],
        [0.89583,0.8125,0.63194,0.8125,0.36806,0.8125,0.10417,0.8125],
        [0.10417,0.8125,0.04664,0.8125,0,0.76586,0,0.70833],
        [0,0.70833,0,0.70139,0,0.69444,0,0.6875],
        [0,0.6875,0,0.41136,0.22386,0.1875,0.5,0.1875],
        [0.5,0.1875,0.77614,0.1875,1,0.41136,1,0.6875],
        [1,0.6875,1,0.69444,1,0.70139,1,0.70833],
        [1,0.70833,1,0.7371,0.98834,0.76314,0.96949,0.78199]
      ]
    },
    "oval": {
      "center": [0.5,0.5],
      "bounds": [0,0,1,1],
      "cubics": [
        [0.90846,0.09154,0.94246,0.12555,0.9661,0.16992,0.9774,0.22267],
        [0.9774,0.22267,1,0.32818,0.97137,0.45859,0.89782,0.5852],
        [0.89782,0.5852,0.82427,0.71182,0.71182,0.82427,0.5852,0.89782],
        [0.5852,0.89782,0.45859,0.97137,0.32818,1,0.22267,0.9774],
        [0.22267,0.9774,0.11716,0.95481,0.04519,0.88284,0.0226,0.77733],
        [0.0226,0.77733,0,0.67182,0.02863,0.54141,0.10218,0.4148],
        [0.10218,0.4148,0.17573,0.28818,0.28818,0.17573,0.4148,0.10218],
        [0.4148,0.10218,0.54141,0.02863,0.67182,0,0.77733,0.0226],
        [0.77733,0.0226,0.83008,0.0339,0.87445,0.05754,0.90846,0.09154]
      ]
    },
    "pill": {
      "center": [0.5,0.5],
      "bounds": [0,0,1,1],
      "cubics": [
        [0.87316,0.12684,0.9404,0.19407,0.98515,0.28377,0.99546,0.38397],
        [0.99546,0.38397,0.99697,0.3987,0.99849,0.41342,1,0.42814],
        [1,0.42814,0.99936,0.54387,0.9531,0.65468,0.87127,0.73652],
        [0.87127,0.73652,0.82635,0.78143,0.78143,0.82635,0.73652,0.87127],
        [0.73652,0.87127,0.65468,0.9531,0.54387,0.99936,0.42814,1],
        [0.42814,1,0.41342,0.99849,0.3987,0.99697,0.38397,0.99546],
        [0.38397,0.99546,0.18357,0.97485,0.02515,0.81643,0.00454,0.61603],
        [0.00454,0.61603,0.00303,0.6013,0.00151,0.58658,0,0.57186],
        [0,0.57186,0.00064,0.45613,0.0469,0.34532,0.12873,0.26348],
        [0.12873,0.26348,0.17365,0.21857,0.21857,0.17365,0.26348,0.12873],
        [0.26348,0.12873,0.34532,0.0469,0.45613,0.00064,0.57186,0],
        [0.57186,0,0.58658,0.00151,0.6013,0.00303,0.61603,0.00454],
        [0.61603,0.00454,0.71623,0.01485,0.80593,0.0596,0.87316,0.12684]
      ]
    },
    "triangle": {
      "center": [0.5,0.59743],
      "bounds": [0,0.07781,1,0.92219],
      "cubics": [
        [0.5,0.07781,0.54375,0.07781,0.5875,0.09946,0.6125,0.14276],
        [0.6125,0.14276,0.725,0.33762,0.8375,0.53248,0.95,0.72733],
        [0.95,0.72733,1,0.81393,0.9375,0.92219,0.8375,0.92219],
        [0.8375,0.92219,0.6125,0.92219,0.3875,0.92219,0.1625,0.92219],
        [0.1625,0.92219,0.0625,0.92219,0,0.81393,0.05,0.72733],
        [0.05,0.72733,0.1625,0.53248,0.275,0.33762,0.3875,0.14276],
        [0.3875,0.14276,0.4125,0.09946,0.45625,0.07781,0.5,0.07781]
      ]
    },
    "diamond": {
      "center": [0.5,0.50372],
      "bounds": [0.07388,0,0.92612,1],
      "cubics": [
        [0.5,1,0.47271,1,0.44543,0.99256,0.4213,0.97768],
        [0.4213,0.97768,0.39803,0.96333,0.37173,0.92926,0.31913,0.86111],
        [0.31913,0.86111,0.252,0.77413,0.18487,0.68715,0.11774,0.60017],
        [0.11774,0.60017,0.07388,0.54335,0.07388,0.46409,0.11774,0.40727],
        [0.11774,0.40727,0.18487,0.32029,0.252,0.23331,0.31913,0.14633],
        [0.31913,0.14633,0.37173,0.07818,0.39803,0.04411,0.4213,0.02975],
        [0.4213,0.02975,0.46955,0,0.53045,0,0.5787,0.02975],
        [0.5787,0.02975,0.60197,0.04411,0.62827,0.07818,0.68087,0.14633],
        [0.68087,0.14633,0.748,0.23331,0.81513,0.32029,0.88226,0.40727],
        [0.88226,0.40727,0.92612,0.46409,0.92612,0.54335,0.88226,0.60017],
        [0.88226,0.60017,0.81513,0.68715,0.748,0.77413,0.68087,0.86111],
        [0.68087,0.86111,0.62827,0.92925,0.60197,0.96333,0.5787,0.97768],
        [0.5787,0.97768,0.55457,0.99256,0.52729,1,0.5,1]
      ]
    },
    "clam-shell": {
      "center": [0.5,0.5],
      "bounds": [0,0.16277,1,0.83723],
      "cubics": [
        [0.18729,0.81565,0.16358,0.80175,0.14351,0.78165,0.1296,0.75683],
        [0.1296,0.75683,0.09425,0.69371,0.0589,0.6306,0.02355,0.56748],
        [0.02355,0.56748,0.00006,0.52554,0,0.47442,0.0234,0.43243],
        [0.0234,0.43243,0.05849,0.36945,0.09359,0.30646,0.12868,0.24348],
        [0.12868,0.24348,0.15644,0.19365,0.209,0.16277,0.26604,0.16277],